{
  "$schema": "./catalog.schema.json",
  "schema_version": "1.0",
  "repository": "mfreeze77/exais-football-ai",
  "updated_at": "2026-10-13",
  "milestones": [
    {
      "id": "M1",
      "title": "Working local film library and safe external adapter foundations",
      "status": "implemented",
      "exit_criteria": [
        "Import existing clips, preserve originals, trim/label/review/retrieve them, manage playlists, and export audio-preserving MP4s through the local UI.",
        "Qualify local API, persistence, provenance, and real FFmpeg behavior; verify installed-package assets.",
        "Provide Kinovea handoff/sidecar preservation and CV suggestion import as explicit optional adapters. Real Windows execution and model inference remain separate later gates."
      ]
    },
    {
      "id": "M2",
      "title": "Faster film study and deeper Kinovea interoperability",
      "status": "planned",
      "exit_criteria": [
        "Support consistent/batch labeling, alternative cuts, accurate frame navigation, comparisons, annotations, and saved review sessions.",
        "Validate versioned KVA interpretation and conflict-aware reconciliation without losing original sidecars."
      ]
    },
    {
      "id": "M3",
      "title": "Qualified optional football computer vision",
      "status": "planned",
      "exit_criteria": [
        "Establish a pinned external environment, reviewed calibration/pre-snap inputs, bounded jobs, and complete source-bound artifacts.",
        "Render audio-preserving overlays, maintain correction/identity decisions, and evaluate representative owner-approved footage.",
        "Calibration transfer and track-quality improvements remain explicit evidence-gated enhancements."
      ]
    },
    {
      "id": "M4",
      "title": "Desktop convenience, recovery, scale, and release confidence",
      "status": "planned",
      "exit_criteria": [
        "Qualify declared macOS/Windows installation paths and supported Kinovea versions.",
        "Demonstrate full backup/restore, portable exports, migration/write-failure recovery, and safe derived-cache cleanup.",
        "Record scale/media limits, dependency provenance, and final capability-specific release evidence. Independent recovery work can start immediately after M1."
      ]
    }
  ],
  "sources": [
    {
      "id": "FCV-README",
      "title": "football-cv README and author-reported evaluation",
      "url": "https://github.com/andrewneuwirth/football-cv/blob/38f6f758d3e78af3b700f144214c2d4566459c5d/README.md",
      "kind": "upstream_code",
      "revision": "38f6f758d3e78af3b700f144214c2d4566459c5d",
      "reviewed_at": "2026-10-13",
      "notes": "Documentation describes alignment-derived position groups; evaluation is author-reported on private labels. Detector wording drifts from code."
    },
    {
      "id": "FCV-API",
      "title": "football-cv high-level analysis API",
      "url": "https://github.com/andrewneuwirth/football-cv/blob/38f6f758d3e78af3b700f144214c2d4566459c5d/footballcv/api.py",
      "kind": "upstream_code",
      "revision": "38f6f758d3e78af3b700f144214c2d4566459c5d",
      "reviewed_at": "2026-10-13",
      "notes": "Explicit persistent data_dir and play_id are needed; default analysis uses a temporary directory."
    },
    {
      "id": "FCV-DETECT",
      "title": "football-cv detector implementation",
      "url": "https://github.com/andrewneuwirth/football-cv/blob/38f6f758d3e78af3b700f144214c2d4566459c5d/footballcv/detect.py",
      "kind": "upstream_code",
      "revision": "38f6f758d3e78af3b700f144214c2d4566459c5d",
      "reviewed_at": "2026-10-13",
      "notes": "Selects RF-DETR when available, otherwise torchvision Faster R-CNN; dependency guard still checks ultralytics. MPS/CPU selection. Heavy model construction may obtain weights."
    },
    {
      "id": "FCV-OVERLAY",
      "title": "football-cv overlay renderer",
      "url": "https://github.com/andrewneuwirth/football-cv/blob/38f6f758d3e78af3b700f144214c2d4566459c5d/viewer/backend/overlay.py",
      "kind": "upstream_code",
      "revision": "38f6f758d3e78af3b700f144214c2d4566459c5d",
      "reviewed_at": "2026-10-13",
      "notes": "Frame-based MP4 rendering does not carry source audio into its output; wrapper must preserve media provenance and timing."
    },
    {
      "id": "FCV-SERVER",
      "title": "football-cv local viewer server",
      "url": "https://github.com/andrewneuwirth/football-cv/blob/38f6f758d3e78af3b700f144214c2d4566459c5d/viewer/backend/serve.py",
      "kind": "upstream_code",
      "revision": "38f6f758d3e78af3b700f144214c2d4566459c5d",
      "reviewed_at": "2026-10-13",
      "notes": "Development viewer APIs for frames, calibration, analysis stages, and artifacts; not the application's production server."
    },
    {
      "id": "FCV-LANDING",
      "title": "football-cv viewer landing page",
      "url": "https://github.com/andrewneuwirth/football-cv/blob/38f6f758d3e78af3b700f144214c2d4566459c5d/viewer/web/index.html",
      "kind": "upstream_code",
      "revision": "38f6f758d3e78af3b700f144214c2d4566459c5d",
      "reviewed_at": "2026-10-13",
      "notes": "Upload handler attaches a local object URL for playback and explicitly says analysis requires the backend."
    },
    {
      "id": "KIN-DOWNLOAD",
      "title": "Kinovea official downloads, platform requirements, and license",
      "url": "https://kinovea.org/download/",
      "kind": "official_documentation",
      "revision": "2025.2.0 download page, reviewed 2026-10-13",
      "reviewed_at": "2026-10-13",
      "notes": "Windows x86-64; official page excludes Apple Silicon support. GPL v2. External application only."
    },
    {
      "id": "KIN-MANUAL",
      "title": "Kinovea official reference manual",
      "url": "https://kinovea.org/help/en/index.html",
      "kind": "official_documentation",
      "revision": "0.9.5 manual",
      "reviewed_at": "2026-10-13",
      "notes": "Describes playback, comparison, annotations, measurements, and exports. Older manual must be read with release notes."
    },
    {
      "id": "KIN-2023",
      "title": "Kinovea 2023.1 release notes",
      "url": "https://kinovea.org/download/releases/2023.1.html",
      "kind": "official_documentation",
      "revision": "2023.1",
      "reviewed_at": "2026-10-13",
      "notes": "Working-zone boundaries and import options can persist in annotations; time-origin alignment affects importing into different videos."
    },
    {
      "id": "KIN-2025",
      "title": "Kinovea 2025.1 release notes",
      "url": "https://kinovea.org/download/releases/2025.1.html",
      "kind": "official_documentation",
      "revision": "2025.1",
      "reviewed_at": "2026-10-13",
      "notes": "Documents -video2 comparison launch and multi-window behavior."
    },
    {
      "id": "KIN-2025-2",
      "title": "Kinovea 2025.2 release notes",
      "url": "https://kinovea.org/download/releases/2025.2.html",
      "kind": "official_documentation",
      "revision": "2025.2",
      "reviewed_at": "2026-10-13",
      "notes": "Includes timing and KVA loading fixes; release-specific integration fixtures are necessary."
    }
  ],
  "tickets": [
    {
      "id": "EFA-001",
      "title": "Establish the local application and capability boundary",
      "milestone": "M1",
      "priority": "P0",
      "status": "implemented",
      "area": "foundation",
      "outcome": "Start a private film room on one computer with actionable setup feedback and no automatic external processing.",
      "scope": [
        "Create the Python package, CLI, same-origin static application, and FastAPI startup/shutdown lifecycle.",
        "Load app-owned workspace configuration and expose health/capability information for FFmpeg, ffprobe, Kinovea, and optional football-cv."
      ],
      "non_goals": [
        "Public hosting, account management, provider uploads, automatic weight downloads, or native desktop installers."
      ],
      "acceptance_checks": [
        "A fresh configured data directory starts through the documented CLI and responds on loopback.",
        "GET /api/health reports the application version and an explicit available/reason state for each optional capability.",
        "Starting the app performs no film upload, model execution, or model download.",
        "Startup and shutdown create/close the database and export worker without leaving duplicate workers."
      ],
      "dependencies": [],
      "risks": [
        "An optional missing executable must disable its dependent feature without hiding the rest of the library.",
        "Do not confuse an importable Python dependency with a qualified native application or trained model."
      ],
      "source_refs": [],
      "evidence": [
        "Qualified candidate commit 153e5073e918dc06d28b4615f2d7749ed9e5b62b, 2026-10-13; Linux, Python 3.12.14, FFmpeg/ffprobe 6.1.1 locally; Python 3.11/3.12 and Firefox in CI.",
        "app.py, cli.py and config.py: loopback startup, health, body/origin limits, lifecycle and instance lock; installed-wheel startup checked.",
        "Passing CI: https://github.com/mfreeze77/exais-football-ai/actions/runs/38332745633",
        "Full qualification evidence: docs/QUALIFICATION.md. Candidate awaits accepted merge in https://github.com/mfreeze77/exais-football-ai/pull/49; separately scoped native/model/platform gates remain unrun."
      ],
      "github_issue": {
        "number": 1,
        "url": "https://github.com/mfreeze77/exais-football-ai/issues/1"
      },
      "body_path": "docs/tickets/EFA-001.md"
    },
    {
      "id": "EFA-002",
      "title": "Persist film records and immutable source provenance",
      "milestone": "M1",
      "priority": "P0",
      "status": "implemented",
      "area": "storage",
      "outcome": "Keep every review attached to the correct original film across application restarts.",
      "scope": [